{
  "$schema": "http://json-schema.org/draft-07/schema#",
  "$id": "https://promptcraft.com/schemas/video-prompt.json",
  "title": "视频分镜脚本提示词Schema",
  "description": "用于视频分镜脚本提示词生成的结构化JSON Schema，支持各种镜头类型和运镜方式",
  "type": "object",
  "properties": {
    "title": {
      "type": "string",
      "description": "视频标题",
      "minLength": 1,
      "maxLength": 200
    },
    "duration": {
      "oneOf": [
        {
          "type": "string",
          "description": "时长格式 HH:MM:SS",
          "pattern": "^([0-9]{1,2}):([0-5][0-9]):([0-5][0-9])$"
        },
        {
          "type": "number",
          "description": "时长（秒数）",
          "minimum": 1,
          "maximum": 86400
        }
      ],
      "description": "视频时长，支持 'HH:MM:SS' 格式或秒数"
    },
    "style": {
      "type": "string",
      "description": "脚本风格标签",
      "enum": [
        "dramatic",
        "informative",
        "creative"
      ]
    },
    "scenes": {
      "type": "array",
      "description": "分镜场景列表",
      "items": {
        "type": "object",
        "properties": {
          "sceneNumber": {
            "type": "integer",
            "description": "场景编号",
            "minimum": 1
          },
          "cameraMovement": {
            "type": "string",
            "description": "运镜说明（如推镜、摇镜、跟镜等）",
            "minLength": 1,
            "maxLength": 100
          },
          "description": {
            "type": "string",
            "description": "场景描述",
            "minLength": 1,
            "maxLength": 500
          },
          "shotType": {
            "type": "string",
            "description": "镜头类型",
            "enum": [
              "extremeWideShot",
              "wideShot",
              "mediumShot",
              "mediumCloseUp",
              "closeUp",
              "extremeCloseUp",
              "overTheShoulder",
              "pointOfView",
              "lowAngleShot",
              "highAngleShot",
              "dutchAngle"
            ]
          },
          "dialogue": {
            "type": "string",
            "description": "对话或旁白（可选）",
            "maxLength": 1000
          },
          "action": {
            "type": "string",
            "description": "动作说明（可选）",
            "maxLength": 500
          }
        },
        "required": [
          "sceneNumber",
          "cameraMovement",
          "description",
          "shotType"
        ],
        "additionalProperties": false
      },
      "minItems": 1,
      "uniqueItems": false
    },
    "promptText": {
      "type": "string",
      "description": "最终拼接的完整视频脚本提示词",
      "minLength": 1,
      "maxLength": 5000
    }
  },
  "required": [
    "title",
    "duration",
    "style",
    "scenes",
    "promptText"
  ],
  "additionalProperties": false
}